{
  "appVersion": "0.25.0",
  "tpqn": 480,
  "tempoBpm": 120,
  "timeSignature": {
    "beats": 4,
    "beatType": 4
  },
  "queryDefaults": {
    "speedScale": 1.0,
    "pitchScale": 0.0,
    "intonationScale": 1.0,
    "volumeScale": 1.0,
    "pauseLengthScale": 1.0,
    "prePhonemeLength": 0.1,
    "postPhonemeLength": 0.1,
    "outputSamplingRate": "engineDefault",
    "outputStereo": false
  }
}
